{
  "choice_path_schema_version": "csd-choice-path/0.4",
  "maximum_trajectory_steps": 8,
  "performance_policy_status": "unfrozen",
  "pilot_trajectory_count": 10000,
  "release": "v0.4",
  "release_blocked_until_policies_frozen": true,
  "rng_algorithm": "csd-choice-hmac-sha256-rejection",
  "rng_version": "1",
  "root_seed": "f44e3f73e886fb09389790455b985efd8bcfcc7e096940bcdbab3e0ebacecd1b",
  "root_seed_provenance": "uniform-random-256",
  "schema_version": "0.4.0",
  "split_hash_salt": "csd-foundry-v0.4-structural-family-split",
  "stochastic_risk_policy_status": "unfrozen",
  "target_trajectory_count": 100000
}
